id,conversation_id,created_at,date,time,timezone,user_id,username,name,place,tweet,language,mentions,urls,photos,replies_count,retweets_count,likes_count,hashtags,cashtags,link,retweet,quote_url,video,thumbnail,near,geo,source,user_rt_id,user_rt,retweet_id,reply_to,retweet_date,translate,trans_src,trans_dest
1459750472672329729,1459750472672329729,2021-11-14 05:10:08 UTC,2021-11-14,05:10:08,+0000,1116810719054397440,mannystweet88,MannysTweet88 😎 (A-Pex Differencemaker),,#AEWFullGear: Done watching!  https://t.co/dQlP9Ao8ea,en,[],[],['https://pbs.twimg.com/media/FEITURxXMAITa1J.jpg'],0,0,0,['aewfullgear'],[],https://twitter.com/MannysTweet88/status/1459750472672329729,False,,1,https://pbs.twimg.com/media/FEITURxXMAITa1J.jpg,,,,,,,[],,,,
1459750471875321857,1459750471875321857,2021-11-14 05:10:08 UTC,2021-11-14,05:10:08,+0000,882275245121572865,kendizzlest,SilverSoulKen || 小石川 チエ SIMP,,"Hangman/Kenny ruled and I loved it, but is it a stretch for me to say that I still think MJF/Darby was MOTN by FAR? #AEWFullGear",en,[],[],[],0,0,1,['aewfullgear'],[],https://twitter.com/KenDizzleST/status/1459750471875321857,False,,0,,,,,,,,[],,,,
1459750470369619968,1459750470369619968,2021-11-14 05:10:07 UTC,2021-11-14,05:10:07,+0000,847923267541377024,steelcagesammy,SteelCageSammy,,"Well I absolutely loved #AEWFullGear top to bottom. Kenny and Hangman sure do know how to tell a story in the ring, wow.",en,[],[],[],0,0,2,['aewfullgear'],[],https://twitter.com/SteelCageSammy/status/1459750470369619968,False,,0,,,,,,,,[],,,,
1459750467744026626,1459750467744026626,2021-11-14 05:10:07 UTC,2021-11-14,05:10:07,+0000,2530810509,kahunamonsoon,Kahuna Monsoon,,Hey @AEW how do you expect me to go to sleep after that show?!?!? #AEWFullGear,en,"[{'screen_name': 'aew', 'name': 'all elite wrestling', 'id': '1054863627029598208'}]",[],[],0,0,1,['aewfullgear'],[],https://twitter.com/KahunaMonsoon/status/1459750467744026626,False,,0,,,,,,,,[],,,,
1459750464254267396,1459750464254267396,2021-11-14 05:10:06 UTC,2021-11-14,05:10:06,+0000,2589954674,viva_zero,Dylan Fox/方灵 🇨🇳🇺🇸🦋,,What would be your letter grade for #AEWFullGear on the whole?,en,[],[],[],4,0,1,['aewfullgear'],[],https://twitter.com/Viva_Zero/status/1459750464254267396,False,,0,,,,,,,,[],,,,
1459750460093571075,1459750460093571075,2021-11-14 05:10:05 UTC,2021-11-14,05:10:05,+0000,700487162924404736,donaghcorby_,Donagh Corby,,10K Takes is All Elite #AEWFullGear #AEW @Wags10k  https://t.co/NwyeII5vs6,en,"[{'screen_name': 'wags10k', 'name': 'wags10k', 'id': '829849568'}]",[],['https://pbs.twimg.com/media/FEITTfTWUAQCD96.jpg'],1,3,5,"['aewfullgear', 'aew']",[],https://twitter.com/DonaghCorby_/status/1459750460093571075,False,,1,https://pbs.twimg.com/media/FEITTfTWUAQCD96.jpg,,,,,,,[],,,,
1459750457245458434,1459750457245458434,2021-11-14 05:10:04 UTC,2021-11-14,05:10:04,+0000,1025666172,npcaaron,Aaron Donogh,,"Alright, I teared up when the Dark Order showed up.  #AEWFullGear",en,[],[],[],0,0,0,['aewfullgear'],[],https://twitter.com/npcaaron/status/1459750457245458434,False,,0,,,,,,,,[],,,,
1459750456259923969,1459750456259923969,2021-11-14 05:10:04 UTC,2021-11-14,05:10:04,+0000,1458263169160425474,geekthegoon,Wrestling DVD Geek,,This was a phenomenal show tonight and I honestly think this show is neck &amp; neck with All Out 2021! Good shit @TonyKhan #AEWFullGear #AEW,en,"[{'screen_name': 'tonykhan', 'name': 'tony khan', 'id': '397823963'}]",[],[],0,0,0,"['aewfullgear', 'aew']",[],https://twitter.com/geekthegoon/status/1459750456259923969,False,,0,,,,,,,,[],,,,
1459750453772759040,1459750453772759040,2021-11-14 05:10:03 UTC,2021-11-14,05:10:03,+0000,46566659,jowoco,Jordan Worth Cobb 🏳️‍⚧️ ⚢ Alternative Femme Era,,"I know I have said it a lot and well, I do mean it tonight because fucking hell, I love wrestling! #AEWFullGear",en,[],[],[],0,0,0,['aewfullgear'],[],https://twitter.com/JoWoCo/status/1459750453772759040,False,,0,,,,,,,,[],,,,
1459750440707502082,1459750440707502082,2021-11-14 05:10:00 UTC,2021-11-14,05:10:00,+0000,21049677,davidbix,David Bixenspan,,"Jesus Christ, why is Matt Jackson's embarrassing community theater I'm Sorry I Love You face acting a sacred cow for some people? He's bad at it. He's been bad at it for years. He does a lot of other things really well! Go do those! #AEWFullGear",en,[],[],[],18,2,65,['aewfullgear'],[],https://twitter.com/davidbix/status/1459750440707502082,False,,0,,,,,,,,[],,,,
1459750438262255617,1459750438262255617,2021-11-14 05:09:59 UTC,2021-11-14,05:09:59,+0000,932998595246215168,wrestling_x9,Wrestling x9,,أخيراً ❤❤❤😍😍😍😍🔥   سعيد جداً جداً جداً 😍❤  #AEWFullGear,ar,[],[],[],0,0,0,['aewfullgear'],[],https://twitter.com/Wrestling_x9/status/1459750438262255617,False,https://twitter.com/Wrestling_x9/status/1459747491692306440,0,,,,,,,,[],,,,
1459750435619807238,1459748272810123266,2021-11-14 05:09:59 UTC,2021-11-14,05:09:59,+0000,177814171,jedi_marcos,House Martinez,,@AEW @theAdamPage I’m not crying…. 😍😭😭😭😭 #AEWFullGear  https://t.co/jDylAhW4o6,en,[],[],['https://pbs.twimg.com/tweet_video_thumb/FEITSAMXMAc5HFx.jpg'],0,0,0,['aewfullgear'],[],https://twitter.com/Jedi_Marcos/status/1459750435619807238,False,,1,https://pbs.twimg.com/tweet_video_thumb/FEITSAMXMAc5HFx.jpg,,,,,,,"[{'screen_name': 'AEW', 'name': 'All Elite Wrestling', 'id': '1054863627029598208'}, {'screen_name': 'theAdamPage', 'name': 'HANGMAN PAGE', 'id': '195863018'}]",,,,
1459750435410087937,1459750435410087937,2021-11-14 05:09:59 UTC,2021-11-14,05:09:59,+0000,948066439491178496,vet_only,VET DA BROOKLYN BEAST,,#AEWFullGear that was a PAY PER VIEW no bull shit,en,[],[],[],0,1,1,['aewfullgear'],[],https://twitter.com/VET_ONLY/status/1459750435410087937,False,,0,,,,,,,,[],,,,
1459750431769378822,1459750431769378822,2021-11-14 05:09:58 UTC,2021-11-14,05:09:58,+0000,1028807657212264448,kenton_la,Kenton,,Twas the end for Kenneth 🔥🏇  #AEWFullGear    https://t.co/koCqlWy0Za,en,[],[],['https://pbs.twimg.com/tweet_video_thumb/FEIQKPGXMAkEJM2.jpg'],0,1,3,['aewfullgear'],[],https://twitter.com/Kenton_la/status/1459750431769378822,False,,1,https://pbs.twimg.com/tweet_video_thumb/FEIQKPGXMAkEJM2.jpg,,,,,,,[],,,,
1459750431693889537,1459750431693889537,2021-11-14 05:09:58 UTC,2021-11-14,05:09:58,+0000,395999538,theiandreese,Ian The Elite #BLM,,Pro wrestling is the greatest sport in the world. #AEWFullGear,en,[],[],[],0,0,0,['aewfullgear'],[],https://twitter.com/TheIanDReese/status/1459750431693889537,False,,0,,,,,,,,[],,,,
1459750431454728196,1459750431454728196,2021-11-14 05:09:58 UTC,2021-11-14,05:09:58,+0000,345222893,numberonemarcus,Marcus Pearson,,Hangman went from feeling unaccepted by his old friends and turning to alcohol to smacking down a can of beer and jumping into an embrace with his new friends. Beautiful. #AEWFullGear,en,[],[],[],0,0,3,['aewfullgear'],[],https://twitter.com/numberonemarcus/status/1459750431454728196,False,,0,,,,,,,,[],,,,
1459750430355992577,1459750430355992577,2021-11-14 05:09:58 UTC,2021-11-14,05:09:58,+0000,1348773095734173696,valenciaseeyou,💍Valencia💍⭐Opal⭐💫 S🅰️🅰️ 🦥♠️💚♠️🏹💚🏹🦥,,The CHAMP had ARRIVED 🐎🐎🐎🐎 #HANGMAN #AEWFullGear  https://t.co/wTCzmTMx8o,en,[],[],['https://pbs.twimg.com/tweet_video_thumb/FEITRrQXoAQyLsq.jpg'],0,1,1,"['hangman', 'aewfullgear']",[],https://twitter.com/valenciaseeyou/status/1459750430355992577,False,,1,https://pbs.twimg.com/tweet_video_thumb/FEITRrQXoAQyLsq.jpg,,,,,,,[],,,,
1459750429261283328,1459750429261283328,2021-11-14 05:09:57 UTC,2021-11-14,05:09:57,+0000,908212994399752192,simplydesto,Des ❤️‍🔥,,The @youngbucks are my sons. #AEWFullGear 🥺❤️,en,"[{'screen_name': 'youngbucks', 'name': 'young bucks®', 'id': '33055971'}]",[],[],0,0,0,['aewfullgear'],[],https://twitter.com/simplydesto/status/1459750429261283328,False,,0,,,,,,,,[],,,,
1459750427394822146,1459750427394822146,2021-11-14 05:09:57 UTC,2021-11-14,05:09:57,+0000,1390040889729429507,_ajspringer,Andy is celebrating Hangman being CHAMP!,,#COWBOYSHIT! #AEWFullGear,und,[],[],[],0,0,0,"['cowboyshit', 'aewfullgear']",[],https://twitter.com/_AJSpringer/status/1459750427394822146,False,,0,,,,,,,,[],,,,
1459750426572734466,1459750426572734466,2021-11-14 05:09:57 UTC,2021-11-14,05:09:57,+0000,1349512372709433346,honjoualtair,Altair Honjou,,"THIS IS WHY I LOVE PRO WRESTLING, ONE OF THE MOST EPIC MOMENTS EVER ADAM FUCKING DID IT, 2 YEARS BUILDING SUCH AMAZING HISTORY!!!!!!!!!!!!!!!!!!!!!!! #AEWFullGear #CowboyShit #AndNew",en,[],[],[],0,1,0,"['aewfullgear', 'cowboyshit', 'andnew']",[],https://twitter.com/HonjouAltair/status/1459750426572734466,False,https://twitter.com/AEW/status/1459747239652474887,0,,,,,,,,[],,,,
1459750425670922240,1459750425670922240,2021-11-14 05:09:56 UTC,2021-11-14,05:09:56,+0000,1436830267252035606,mattc0316,MattC325,,"Adam Page,, fuck yeah!! Aew WORLD Champion #AEWFullGear",en,[],[],[],0,0,2,['aewfullgear'],[],https://twitter.com/MattC0316/status/1459750425670922240,False,,0,,,,,,,,[],,,,
1459750425595461636,1459750425595461636,2021-11-14 05:09:56 UTC,2021-11-14,05:09:56,+0000,1134839458069700610,prowrestlingjoe,J ,,"Where's the 1080 HD photo of Hangman with the title, I need it 10 minutes ago. #AEWFullGear",en,[],[],[],0,3,19,['aewfullgear'],[],https://twitter.com/ProWrestlingJoe/status/1459750425595461636,False,,0,,,,,,,,[],,,,
1459750423452172296,1459750423452172296,2021-11-14 05:09:56 UTC,2021-11-14,05:09:56,+0000,370906300,danpgsimpson,"Dan Simpson, Eyebrow Cinema",,Full Gear was a fun show! A couple of missteps but also a ton of great bouts and even the worst matches had their moments. So happy to see Hangman win the title. Beautifully done too #AEWFullGear #AEW,en,[],[],[],1,0,0,"['aewfullgear', 'aew']",[],https://twitter.com/danpgsimpson/status/1459750423452172296,False,,0,,,,,,,,[],,,,
1459750422747353089,1459750422747353089,2021-11-14 05:09:56 UTC,2021-11-14,05:09:56,+0000,109686033,konirokei,紺色,,#AEWFullGear 終わった…。 すごかった…。 サプライズらしいサプライズ(タイトル移動関連はサプライズではないとして)はなかったけど、とにかく4時間ぶっ続けですごい試合の連続で、楽しかったです…。 アメリカでは夜8時から始まりだからメイン終わりは午前0時か…それもそれですごい😲💦 #AEW,ja,[],[],[],0,0,0,"['aewfullgear', 'aew']",[],https://twitter.com/konirokei/status/1459750422747353089,False,,0,,,,,,,,[],,,,
1459750422357422080,1459750422357422080,2021-11-14 05:09:56 UTC,2021-11-14,05:09:56,+0000,2716222843,entre410,Sir Entré Chaplin,,THAT NOD THOUGH! Congrats @theAdamPage ❤️‍🔥. COWBOY SH*T! #AEW #AEWFULLGEAR #ADAMPAGE #COWBOYSHIT,en,"[{'screen_name': 'theadampage', 'name': 'hangman page', 'id': '195863018'}]",[],[],0,1,2,"['aew', 'aewfullgear', 'adampage', 'cowboyshit']",[],https://twitter.com/Entre410/status/1459750422357422080,False,,0,,,,,,,,[],,,,
1459750421715689478,1459750421715689478,2021-11-14 05:09:56 UTC,2021-11-14,05:09:56,+0000,313019411,bigheadjosh92,Joshua Cercado,,"AEW Full Gear was awesome! So many crazy awesome matches. ""Hangman"" Adam Page finally did it winning the AEW Championship against Kenny Omega. Britt Baker retained. Lucha Bros retained. Bryan Danielson won the tournament and is number one contender. #AEWFullGear",en,[],[],[],0,1,0,['aewfullgear'],[],https://twitter.com/bigheadjosh92/status/1459750421715689478,False,,0,,,,,,,,[],,,,
1459750421417897984,1459750421417897984,2021-11-14 05:09:55 UTC,2021-11-14,05:09:55,+0000,1073507199022972928,notuangle,🛸,,#AEWFullGear has to be a candidate for show of the year. absolutely phenomenal show!!!,en,[],[],[],0,1,1,['aewfullgear'],[],https://twitter.com/notuangle/status/1459750421417897984,False,,0,,,,,,,,[],,,,
1459750421359173635,1459750421359173635,2021-11-14 05:09:55 UTC,2021-11-14,05:09:55,+0000,2448915108,lahill122,Queen Libby 👸🏻🖤,,"First time he’s been on the edge of his seat in long time, thanks  #aew #AEWFullGear  https://t.co/SbJhiZ5BRk",en,[],[],['https://pbs.twimg.com/media/FEITRSvXIAIOqRq.jpg'],0,0,5,"['aew', 'aewfullgear']",[],https://twitter.com/lahill122/status/1459750421359173635,False,,1,https://pbs.twimg.com/media/FEITRSvXIAIOqRq.jpg,,,,,,,[],,,,
1459750420449046532,1459750420449046532,2021-11-14 05:09:55 UTC,2021-11-14,05:09:55,+0000,3169098661,thahustleman330,S.Carter,,That was one of the best main events in #AEW  pay per view history. The long term storytelling has come full circle for Hangman Adam Page as he is the new AEW World Champion. The Young Bucks giving their blessing to an old friend is the highest of respect. Loved it! #AEWFullGear,en,[],[],[],0,1,1,"['aew', 'aewfullgear']",[],https://twitter.com/ThaHustleMan330/status/1459750420449046532,False,,0,,,,,,,,[],,,,
1459750419329077248,1459750419329077248,2021-11-14 05:09:55 UTC,2021-11-14,05:09:55,+0000,1346597892539166727,the2000manpw,Tom Brice,,GET OUT KENNY GET OUTTTTTT  SUIIIIIIII #AEWFullGear  https://t.co/E1pwCk30J5,en,[],[],[],0,0,0,['aewfullgear'],[],https://twitter.com/The2000ManPW/status/1459750419329077248,False,,1,https://pbs.twimg.com/ext_tw_video_thumb/1459750371929300994/pu/img/ihITytQqCXUyqja0.jpg,,,,,,,[],,,,
1459750417806602247,1459750417806602247,2021-11-14 05:09:55 UTC,2021-11-14,05:09:55,+0000,476077957,thorpie15,Sean Lee,,🙌🏼🙌🏼🙌🏼🙌🏼😁 #CowboyShit 🤠🐎 That was fuckin awesome. #AEWFullGear,en,[],[],[],0,0,0,"['cowboyshit', 'aewfullgear']",[],https://twitter.com/thorpie15/status/1459750417806602247,False,https://twitter.com/AEW/status/1459747239652474887,0,,,,,,,,[],,,,
1459750416275542018,1459750416275542018,2021-11-14 05:09:54 UTC,2021-11-14,05:09:54,+0000,2991280343,junrockk,𝒋𝒖𝒏.,,かっけええ…  #AEWFullGear,ja,[],[],[],0,0,0,['aewfullgear'],[],https://twitter.com/junrockk/status/1459750416275542018,False,https://twitter.com/AEW/status/1459708943345848325,0,,,,,,,,[],,,,
1459750413218066433,1459750413218066433,2021-11-14 05:09:54 UTC,2021-11-14,05:09:54,+0000,947131543159496705,thisgengamingyt,ThisGenGaming,,Good solid show tonight. I personally feel All Out was a much better PPV though. Felt like tonight had quite a few more questionable moments. #AEWFullGear,en,[],[],[],1,0,6,['aewfullgear'],[],https://twitter.com/ThisGenGamingYT/status/1459750413218066433,False,,0,,,,,,,,[],,,,
1459750412341456899,1459750412341456899,2021-11-14 05:09:53 UTC,2021-11-14,05:09:53,+0000,967061101853757440,aewandtnafan5,AEW FOREVER,,Well done @KennyOmegamanX   This has been a legendary run as world champion!  And in my opinion the greatest #AEW world champion yet!  This reign will be remembered #AEWFullGear  https://t.co/1uSgnpEO1o,en,"[{'screen_name': 'kennyomegamanx', 'name': 'kenny omega', 'id': '2879312390'}]",[],"['https://pbs.twimg.com/media/FEITQtIXIAAy5EM.jpg', 'https://pbs.twimg.com/media/FEITQtJWUAEvfos.jpg', 'https://pbs.twimg.com/media/FEITQtKX0AE1bLL.jpg', 'https://pbs.twimg.com/media/FEITQtIWQAI_vaw.jpg']",2,20,80,"['aew', 'aewfullgear']",[],https://twitter.com/AEWandTNAfan5/status/1459750412341456899,False,,1,https://pbs.twimg.com/media/FEITQtIXIAAy5EM.jpg,,,,,,,[],,,,
1459750411032838152,1459750411032838152,2021-11-14 05:09:53 UTC,2021-11-14,05:09:53,+0000,636592483,rikunamako,Riku Namako | DJ/Gamer/Weeb ,,"#AEWFullGear2021 exceeded expectations.   I knew it was gonna be good, but holy shit  #AEWFullGear",en,[],[],[],0,1,1,"['aewfullgear2021', 'aewfullgear']",[],https://twitter.com/RikuNamako/status/1459750411032838152,False,,0,,,,,,,,[],,,,
1459750403856343045,1459750403856343045,2021-11-14 05:09:51 UTC,2021-11-14,05:09:51,+0000,1066176002106302464,honestsacfan,Honest Kings Fan 🇲🇽 (5-8),,My #AEWFullGear ratings   MJF vs Darby Allin: 4/5  Lucha Brothers vs FTR: 3/5  Bryan Danielson vs Miro: 3.5/5  Jurassic Express &amp; Christian Cage vs Superkliq: 5/5  Dr. Britt Baker D.M.D. vs Tay Conti: 4/5  Eddie Kingston vs CM Punk: 3/5,en,[],[],[],1,0,0,['aewfullgear'],[],https://twitter.com/HonestSacFan/status/1459750403856343045,False,,0,,,,,,,,[],,,,
1459750402245672963,1459750402245672963,2021-11-14 05:09:51 UTC,2021-11-14,05:09:51,+0000,2429753468,jamar2414,JAMAR LEATH,,SO WHEN WE GONNA GET DANIELSON VS PAGE FOR THE TITLE IT CANT BE IN FEB FOR THE NEXT PPV COULD IT.WHO SAID HANGMAN PAGE COULD BE DANIELSON OPPONENT HANGMAN COULD DROP THE TITLE TO MJF THEN DANIELSON CAN GO FOR IT #AEWFullGear,en,[],[],[],0,0,1,['aewfullgear'],[],https://twitter.com/jamar2414/status/1459750402245672963,False,,0,,,,,,,,[],,,,
1459750400341381122,1459749465821093893,2021-11-14 05:09:50 UTC,2021-11-14,05:09:50,+0000,1018935450,hazzaismyname,Hazzamon,,First Allout then #AEWFullGear .. what a fucking company,en,[],[],[],0,0,1,['aewfullgear'],[],https://twitter.com/hazzaismyname/status/1459750400341381122,False,,0,,,,,,,,[],,,,
1459750398500257796,1459750398500257796,2021-11-14 05:09:50 UTC,2021-11-14,05:09:50,+0000,2540948251,_denisesalcedo,Denise Salcedo,,Okay everyone media scrum about to begin.   I'll be tweeting any notable quotes or news etc.   #AEWFullGear  https://t.co/vYiLWmFRkB,en,[],[],['https://pbs.twimg.com/media/FEITPvvXwAAA1-N.jpg'],9,18,234,['aewfullgear'],[],https://twitter.com/_denisesalcedo/status/1459750398500257796,False,,1,https://pbs.twimg.com/media/FEITPvvXwAAA1-N.jpg,,,,,,,[],,,,
1459750398407888898,1459750398407888898,2021-11-14 05:09:50 UTC,2021-11-14,05:09:50,+0000,950545226585735172,nailsandny,NailsAndNY - Egomaniac,,😍😍😍😍 #EthanPage #Egomaniacs #AEWFullGear,und,[],[],[],0,0,2,"['ethanpage', 'egomaniacs', 'aewfullgear']",[],https://twitter.com/NailsAndNY/status/1459750398407888898,False,https://twitter.com/snoochocolates/status/1459747839198871552,0,,,,,,,,[],,,,
1459750397124366344,1459750397124366344,2021-11-14 05:09:50 UTC,2021-11-14,05:09:50,+0000,723386512960679936,themarkoutmania,MarkoutMania,,How it started vs. How it’s going #AEWFullGear  https://t.co/5JcnFbLNPy,en,[],[],"['https://pbs.twimg.com/media/FEITP5ZVUAADb40.jpg', 'https://pbs.twimg.com/media/FEITP5YVkAIuyWP.jpg']",0,0,1,['aewfullgear'],[],https://twitter.com/TheMarkOutMania/status/1459750397124366344,False,,1,https://pbs.twimg.com/media/FEITP5ZVUAADb40.jpg,,,,,,,[],,,,
1459750391915204608,1459750391915204608,2021-11-14 05:09:48 UTC,2021-11-14,05:09:48,+0000,920285926445678593,inklingmario,Inkling Mario,,All in all #AEWFullGear was absolutely incredibly not one match has let me down not all of them were perfect but majority of them were just fantastic 9/10 for me not a surprise that another AEW PPV has delivered.,en,[],[],[],0,0,0,['aewfullgear'],[],https://twitter.com/InklingMario/status/1459750391915204608,False,,0,,,,,,,,[],,,,
1459750391244021761,1459750391244021761,2021-11-14 05:09:48 UTC,2021-11-14,05:09:48,+0000,1158244324028637184,_gimmickless_,Gimmickless,,"I'm going to let myself fanboy here, I'm over the moon with @AEW having a feel good  great ending,rewarding my viewership.   Mean while @WWE continues to muckspread fetted shit into it's viewers faces over and over.  #AEWFullGear",en,"[{'screen_name': 'aew', 'name': 'all elite wrestling', 'id': '1054863627029598208'}, {'screen_name': 'wwe', 'name': 'wwe', 'id': '7517222'}]",[],[],1,1,2,['aewfullgear'],[],https://twitter.com/_Gimmickless_/status/1459750391244021761,False,,0,,,,,,,,[],,,,
1459750390866472963,1459750390866472963,2021-11-14 05:09:48 UTC,2021-11-14,05:09:48,+0000,1435016568711172098,boomwingedangel,🐻BOOM💥,,"that’ll do, cowboy. that’ll do. 🥲🤠 #AEW #AEWFullGear  https://t.co/P52qdtKYRN",en,[],[],['https://pbs.twimg.com/media/FEITPk4UcAA0RNh.jpg'],0,0,1,"['aew', 'aewfullgear']",[],https://twitter.com/BOOMWINGEDANGEL/status/1459750390866472963,False,,1,https://pbs.twimg.com/media/FEITPk4UcAA0RNh.jpg,,,,,,,[],,,,
1459750385376243712,1459750385376243712,2021-11-14 05:09:47 UTC,2021-11-14,05:09:47,+0000,506244086,josebravo99,jose bravo,,"#AEWFullGear Que buen final... Los Bucks no quitandole la oportunidad a quien también es su amigo, vaya historia... Al fin Adam Page supero a Omega, y se viene la era de un gran tecnico",es,[],[],[],0,0,0,['aewfullgear'],[],https://twitter.com/josebravo99/status/1459750385376243712,False,,0,,,,,,,,[],,,,
1459750385015533570,1459750385015533570,2021-11-14 05:09:47 UTC,2021-11-14,05:09:47,+0000,1317184055868350476,percanova,Rosinante ✨,,That’ll do cowboy that’ll do #AEWFullGear  https://t.co/Md4B0FjJj8,en,[],[],['https://pbs.twimg.com/media/FEITOssWYAAX9KQ.jpg'],0,1,1,['aewfullgear'],[],https://twitter.com/percanova/status/1459750385015533570,False,,1,https://pbs.twimg.com/media/FEITOssWYAAX9KQ.jpg,,,,,,,[],,,,
1459750383165882370,1459746945128230920,2021-11-14 05:09:46 UTC,2021-11-14,05:09:46,+0000,22542908,nefertaya,SammyJ,,@AEWonTNT @theAdamPage @AEW Can we throw some money around to see @theAdamPage ride his horse with the AEW title belt on? Would make an even better background!! #AEWFullGear #AEW,en,"[{'screen_name': 'theadampage', 'name': 'hangman page', 'id': '195863018'}]",[],[],0,0,1,"['aewfullgear', 'aew']",[],https://twitter.com/nefertaya/status/1459750383165882370,False,,0,,,,,,,,"[{'screen_name': 'AEWonTNT', 'name': 'All Elite Wrestling on TNT', 'id': '1128707845589876736'}, {'screen_name': 'theAdamPage', 'name': 'HANGMAN PAGE', 'id': '195863018'}, {'screen_name': 'AEW', 'name': 'All Elite Wrestling', 'id': '1054863627029598208'}]",,,,
1459750382607994881,1459750382607994881,2021-11-14 05:09:46 UTC,2021-11-14,05:09:46,+0000,221163601,samu_eds,samuel,,só modão para comemorar a vitória do adam page  #AEWFullGear  #AEW,pt,[],[],[],0,0,0,"['aewfullgear', 'aew']",[],https://twitter.com/samu_eds/status/1459750382607994881,False,,0,,,,,,,,[],,,,
1459750382515728384,1459750382515728384,2021-11-14 05:09:46 UTC,2021-11-14,05:09:46,+0000,733545228,rickandbenny29,Ben Garrett 🏳️‍🌈,,It's way past this one's bedtime. Gonna have to carry her to bed. #AEWFullGear  https://t.co/EiLr6OZhRw,en,[],[],['https://pbs.twimg.com/media/FEITPJNXoAA45VL.jpg'],0,0,0,['aewfullgear'],[],https://twitter.com/RickAndBenny29/status/1459750382515728384,False,,1,https://pbs.twimg.com/media/FEITPJNXoAA45VL.jpg,,,,,,,[],,,,
1459750381974695937,1459750381974695937,2021-11-14 05:09:46 UTC,2021-11-14,05:09:46,+0000,1427763455335993346,ralphiebeam,ralphie beam,,#cowboysshit no one  aint eating cowboys shit that nasty  any way cograts @theAdamPage  becoming #AEW  champ at #AEWFullGear,en,"[{'screen_name': 'theadampage', 'name': 'hangman page', 'id': '195863018'}]",[],[],0,0,0,"['cowboysshit', 'aew', 'aewfullgear']",[],https://twitter.com/RalphieBeam/status/1459750381974695937,False,,0,,,,,,,,[],,,,
1459750380191973379,1459750380191973379,2021-11-14 05:09:46 UTC,2021-11-14,05:09:46,+0000,62734970,mattadambenigno,Matt Benigno,,Congratulations to @theAdamPage on becoming the new AEW World Champion. #AEW #AEWFullGear,en,"[{'screen_name': 'theadampage', 'name': 'hangman page', 'id': '195863018'}]",[],[],0,0,1,"['aew', 'aewfullgear']",[],https://twitter.com/MattAdamBenigno/status/1459750380191973379,False,,0,,,,,,,,[],,,,
1459750376949702658,1459750376949702658,2021-11-14 05:09:45 UTC,2021-11-14,05:09:45,+0000,1292736729237970945,rombex97,"Kundan !! (Roman, Becky, Edge, Sasha)🐐's",,"Finally, the torture is over. No more of that guy who is not even relevant without a title.  #AEWFullGear",en,[],[],[],0,0,0,['aewfullgear'],[],https://twitter.com/RomBex97/status/1459750376949702658,False,https://twitter.com/Fiend4FolIows/status/1459747207830200321,0,,,,,,,,[],,,,
1459750375565799433,1459750375565799433,2021-11-14 05:09:45 UTC,2021-11-14,05:09:45,+0000,1292586498940907520,electricgiblets,C://electricgiblets,,😭  why do you love pro-wrestling? the hangman page saga from 2019-2021  #AEW #AEWFullGear,en,[],[],[],0,0,1,"['aew', 'aewfullgear']",[],https://twitter.com/electricgiblets/status/1459750375565799433,False,https://twitter.com/AEWonTNT/status/1459746945128230920,0,,,,,,,,[],,,,
1459750370360664065,1459750370360664065,2021-11-14 05:09:43 UTC,2021-11-14,05:09:43,+0000,1434548797,zpyrrhic,pyrrhic 🍝🏴‍☠️,,This shot. My god. #AEWFullGear  https://t.co/Ob3lul2yFK,en,[],[],['https://pbs.twimg.com/media/FEITOPlXEAAdTGf.jpg'],1,0,6,['aewfullgear'],[],https://twitter.com/zPyrrhic/status/1459750370360664065,False,,1,https://pbs.twimg.com/media/FEITOPlXEAAdTGf.jpg,,,,,,,[],,,,
1459750369081311238,1459750369081311238,2021-11-14 05:09:43 UTC,2021-11-14,05:09:43,+0000,2690553683,dupontodilon,The Legend,,HANGMAN IS CHAMPION !  #AEWFullGear  https://t.co/92tpSk3TwJ,en,[],[],['https://pbs.twimg.com/media/FEITOZ7XMAIAQxj.jpg'],0,0,0,['aewfullgear'],[],https://twitter.com/DupontOdilon/status/1459750369081311238,False,,1,https://pbs.twimg.com/media/FEITOZ7XMAIAQxj.jpg,,,,,,,[],,,,
1459750363318394882,1459750363318394882,2021-11-14 05:09:42 UTC,2021-11-14,05:09:42,+0000,327436826,jpegson_,JP,,Oitavo no Brasil tá? #AEWFullGear  https://t.co/WED643vkdh,pt,[],[],['https://pbs.twimg.com/media/FEITMibXoAAuVfx.png'],0,0,0,['aewfullgear'],[],https://twitter.com/Jpegson_/status/1459750363318394882,False,,1,https://pbs.twimg.com/media/FEITMibXoAAuVfx.png,,,,,,,[],,,,
1459750359753277453,1459750359753277453,2021-11-14 05:09:41 UTC,2021-11-14,05:09:41,+0000,864579237197606913,markoutmountain,Matt Likes Wrestling,,Page vs Omega was a banger  #AEWFullGear,en,[],[],[],0,0,1,['aewfullgear'],[],https://twitter.com/MarkoutMountain/status/1459750359753277453,False,,0,,,,,,,,[],,,,
